"category","column","day","description","end_time","event_name","link","published","start_time","zoom_email","zoom_link"
"workshop-event","2","Friday","Don't have a team yet? Not to worry! Join us and find a team to hack with.","04/09/2021 21:30 GMT-0400","Team Formation","https://platform.bit.camp/XhyVM5","true","04/09/2021 21:00 GMT-0400","hello@bit.camp","https://zoom.us/j/9830344588?pwd=Ykg0UTQzQUpUeGJOa3JKU2FwdGl3UT09"
"mini-event","4","Friday","How good is your emoji-speak? Join us for a fun hour of translating between emojis and words!","04/09/2021 22:30 GMT-0400","Emoji Game","https://platform.bit.camp/KTIbS1","true","04/09/2021 21:30 GMT-0400","zoom01@bit.camp","https://zoom.us/j/7314127147?pwd=Tm9SOHJ1ZlVZWTg4eU5lbG40OElDQT09"
"workshop-event","2","Sunday","Not sure how exactly to submit your hack? Come over and find out!","04/11/2021 10:00 GMT-0400","How to Submit Your Hack","https://platform.bit.camp/gpj4Rt","true","04/11/2021 09:00 GMT-0400","zoom01@bit.camp","https://zoom.us/j/7314127147?pwd=Tm9SOHJ1ZlVZWTg4eU5lbG40OElDQT09"
"workshop-event","2","Saturday","Learn how to quickly start sending notifications using Courier. At the end of the workshop, you'll have a working contact form that delivers the submitted form data over Email, SMS, and more.","04/10/2021 16:00 GMT-0400","Triggering Notifications with Courier","https://platform.bit.camp/t3kq5d","true","04/10/2021 15:00 GMT-0400","zoom02@bit.camp","https://zoom.us/j/2472330797?pwd=elM1alNteWwvY0tNUkU3ZXBrbmNIZz09"
"main-event","1","Friday","Get ready to explore together at Bitcamp 2021!","04/09/2021 20:30 GMT-0400","Opening Ceremony","https://www.youtube.com/watch?v=PoPPM45TsNA","true","04/09/2021 19:00 GMT-0400","","https://www.youtube.com/watch?v=PoPPM45TsNA"
"mini-event","4","Saturday","How quickly can you escape? Team up and put your puzzle solving skills to the test as you try to make it out of a virtual escape room!","04/10/2021 18:30 GMT-0400","Escape Room","https://platform.bit.camp/gl99uR","true","04/10/2021 17:00 GMT-0400","zoom04@bit.camp","https://zoom.us/j/4274742251?pwd=K0ErVjlucVdqUUxWRmZlbDBaL0Fhdz09"
"workshop-event","2","Saturday","So you're at a hackathon and you're starting out with the tools that you know to save time and effort on building the app; however, what if you want to use ArcGIS but don't have experience with it? Come to this workshop and use API Keys for activating content, location services, interactive data analysis, and more; you can also create custom web mapping apps with or without code. Join us!","04/10/2021 15:00 GMT-0400","Getting Started with ArcGIS","https://platform.bit.camp/LywVEO","true","04/10/2021 14:00 GMT-0400","zoom02@bit.camp","https://zoom.us/j/2472330797?pwd=elM1alNteWwvY0tNUkU3ZXBrbmNIZz09"
"workshop-event","1","Friday","New to hardware hacking? This is the place for you!","04/09/2021 22:30 GMT-0400","Beginner Hardware Workshop","https://platform.bit.camp/qDs41i","true","04/09/2021 21:30 GMT-0400","zoom02@bit.camp","https://zoom.us/j/2472330797?pwd=elM1alNteWwvY0tNUkU3ZXBrbmNIZz09"
"main-event","1","Saturday","Come watch our 5 Colorwar finalists battle it out in a rapid-fire design contest!","04/10/2021 14:00 GMT-0400","Colorwar","https://platform.bit.camp/uBdFNX","true","04/10/2021 13:00 GMT-0400","zoom01@bit.camp","https://zoom.us/j/7314127147?pwd=Tm9SOHJ1ZlVZWTg4eU5lbG40OElDQT09"
"workshop-event","4","Saturday","Need help designing your hack during Bitcamp? Stop by the Design Den, and Bitcamp's Design team will help you work on your hack's user design interface and user experience. It's like office hours, but for design!","04/10/2021 17:00 GMT-0400","Design Den","https://platform.bit.camp/Sq3Isl","true","04/10/2021 15:00 GMT-0400","zoom01@bit.camp","https://zoom.us/j/7314127147?pwd=Tm9SOHJ1ZlVZWTg4eU5lbG40OElDQT09"
"mini-event","1","Saturday","TIRED 😫 of sitting 🧘‍♀️💢 at your desk all day 🤖? Need a BREAK 🥴🆘 from hacking 💻 ☠?! Get 🔥 FIRED 🆙 with some 💥LITTY💥 TikTok ⏰ dances and a 🌶 SPICY 🥵 Latin Zumba workout!! Come DANCE 💃🕺 and SWEAT 🌚💦 with fellow hackers and organizers 😏😏!!","04/10/2021 20:30 GMT-0400","Dance Party!","https://zoom.us/j/8938906433?pwd=a2FEbXRmbWpIb2VCNnF3dWlMR2IvQT09","true","04/10/2021 20:00 GMT-0400","zoom03@bit.camp","https://zoom.us/j/8938906433?pwd=a2FEbXRmbWpIb2VCNnF3dWlMR2IvQT09"
"main-event","1","Sunday","Present the projects you worked on to our judges and win prizes!","04/11/2021 14:45 GMT-0400","Expo","https://platform.bit.camp/expo-schedule","true","04/11/2021 13:00 GMT-0400","","https://platform.bit.camp/expo-schedule"
"workshop-event","1","Saturday","A follow-up to our beginner hardware workshop. Learn even more about hardware hacking!","04/10/2021 12:00 GMT-0400","Intermediate Hardware Workshop","https://platform.bit.camp/noMRDF","true","04/10/2021 11:00 GMT-0400","zoom02@bit.camp","https://zoom.us/j/2472330797?pwd=elM1alNteWwvY0tNUkU3ZXBrbmNIZz09"
"workshop-event","1","Saturday","Godot is an excellent game engine for beginner and expert game designers. This talk will provide insights into how to get started using Godot by walking through a tutorial for a simple game. We will focus on programming in Godot and give some tips and tricks for using existing assets for games. Recommended: some Python","04/10/2021 17:00 GMT-0400","Getting started with Game Design using Godot","https://platform.bit.camp/kdbOXf","true","04/10/2021 16:00 GMT-0400","zoom02@bit.camp","https://zoom.us/j/2472330797?pwd=elM1alNteWwvY0tNUkU3ZXBrbmNIZz09"
"mini-event","3","Saturday","Slideshow Karaoke is a fun game where participants present random yet topical slide decks without getting to view the content. Join us for some nighttime fun!","2021-04-11T00:00:00.000Z","MLH: Slideshow Karaoke","https://zoom.us/j/4274742251?pwd=K0ErVjlucVdqUUxWRmZlbDBaL0Fhdz09","true","2021-04-10T23:00:00.000Z","zoom04@bit.camp","https://zoom.us/j/4274742251?pwd=K0ErVjlucVdqUUxWRmZlbDBaL0Fhdz09"
"workshop-event","1","Saturday","What is product management? Attend to learn more about it from a 2x startup founder!","04/10/2021 10:00 GMT-0400","Product Management Decoded","https://platform.bit.camp/3Xseoj","true","04/10/2021 09:00 GMT-0400","zoom02@bit.camp","https://zoom.us/j/2472330797?pwd=elM1alNteWwvY0tNUkU3ZXBrbmNIZz09"
"main-event","3","Friday","Meet our sponsors and learn about their opportunities!","04/09/2021 22:30 GMT-0400","Sponsorship Fair","https://platform.bit.camp/sponsors","true","04/09/2021 20:30 GMT-0400","","https://platform.bit.camp/sponsors"
"main-event","1","Friday","Get set, go! Start hacking!","04/09/2021 20:30 GMT-0400","Hacking Begins","https://platform.bit.camp/","true","04/09/2021 20:30 GMT-0400","","https://platform.bit.camp/"
"main-event","3","Saturday","Meet our sponsors and learn about their opportunities!","04/10/2021 17:00 GMT-0400","Sponsorship Fair","https://platform.bit.camp/sponsors","true","04/10/2021 15:00 GMT-0400","","https://platform.bit.camp/sponsors"
"main-event","1","Sunday","Thanks for participating in Bitcamp 2021! We hope you had lots of fun.","04/11/2021 16:00 GMT-0400","Closing Ceremony","https://youtu.be/PoPPM45TsNA","true","04/11/2021 15:30 GMT-0400","","https://youtu.be/PoPPM45TsNA"
"workshop-event","2","Friday","Learn more about how you can use python and the Flask library to make web applications.","04/09/2021 23:00 GMT-0400","Python Web Apps with Flask","https://platform.bit.camp/C2ynsb","true","04/09/2021 22:00 GMT-0400","zoom03@bit.camp","https://zoom.us/j/8938906433?pwd=a2FEbXRmbWpIb2VCNnF3dWlMR2IvQT09"
"main-event","3","Saturday","Meet our sponsors and learn about their opportunities!","04/10/2021 12:00 GMT-0400","Sponsorship Fair","https://platform.bit.camp/sponsors","true","04/10/2021 10:00 GMT-0400","","https://platform.bit.camp/sponsors"
"workshop-event","2","Saturday","A crash course on turning your hackathon project into a venture-scale startup, covering everything from finding ideas to getting users and pitching to investors.","04/10/2021 13:00 GMT-0400","From Concept to Capital","https://platform.bit.camp/A5Q8gg","true","04/10/2021 12:00 GMT-0400","zoom02@bit.camp","https://zoom.us/j/2472330797?pwd=elM1alNteWwvY0tNUkU3ZXBrbmNIZz09"
"workshop-event","2","Friday","Learn more about hackathons and what you can do at Bitcamp.","04/09/2021 21:00 GMT-0400","Bitcamp 101","https://platform.bit.camp/VePXTS","true","04/09/2021 20:30 GMT-0400","zoom01@bit.camp","https://zoom.us/j/7314127147?pwd=Tm9SOHJ1ZlVZWTg4eU5lbG40OElDQT09"
"mini-event","2","Saturday","Take the US Air Force Cybersecurity Challenge for the chance to win prizes","2021-04-10T14:00:00.000Z","MLH: US AF Challenge","https://zoom.us/j/4274742251?pwd=K0ErVjlucVdqUUxWRmZlbDBaL0Fhdz09","true","2021-04-10T13:00:00.000Z","zoom04@bit.camp","https://zoom.us/j/4274742251?pwd=K0ErVjlucVdqUUxWRmZlbDBaL0Fhdz09"
"main-event","1","Saturday","Come through and meet Christopher Weaver, our opening speaker! This is your chance to ask him questions you’d like answered, or listen to fun stories about his time founding Bethesda Softworks.","04/10/2021 15:00 GMT-0400","Q&A with Christopher Weaver","https://platform.bit.camp/HOrQL0","true","04/10/2021 14:00 GMT-0400","hello@bit.camp","https://zoom.us/j/9830344588?pwd=Ykg0UTQzQUpUeGJOa3JKU2FwdGl3UT09"
"workshop-event","2","Saturday","This workshop will detail how to use the Reddit Python Wrapper (PRAW) API to collect data from Reddit and visualize it as a graph database running on AWS. Participants will learn how to interact with an API, query for specific subreddits, transform data into various formats using Python, deploy AWS resources to run applications, and visualize networks of Redditors, posts, and subreddits in three dimensions with GraphXR. Additionally, participants will be introduced to the basics of containers using Docker, as well as a graph querying language called Cypher.","04/10/2021 20:00 GMT-0400","Visualizing Reddit as a Graph DB on AWS","https://platform.bit.camp/3HW317","true","04/10/2021 19:00 GMT-0400","zoom02@bit.camp","https://zoom.us/j/2472330797?pwd=elM1alNteWwvY0tNUkU3ZXBrbmNIZz09"
"mini-event","4","Saturday","Join us for an amazing time of rapid-fire word to song association! Earn points for your team by saying or singing lines from your favorite songs that match our prompts!","04/10/2021 23:30 GMT-0400","Song Association Game","https://zoom.us/j/7314127147?pwd=Tm9SOHJ1ZlVZWTg4eU5lbG40OElDQT09","true","04/10/2021 22:00 GMT-0400","zoom01@bit.camp","https://zoom.us/j/7314127147?pwd=Tm9SOHJ1ZlVZWTg4eU5lbG40OElDQT09"
"main-event","1","Sunday","Hacking is done! Your project should be submitted now.","04/11/2021 10:00 GMT-0400","Hacking Ends","https://platform.bit.camp/","true","04/11/2021 09:30 GMT-0400","","https://platform.bit.camp/"
"workshop-event","2","Saturday","Learn the basics of APIs in this hands-on 101 session with Postman! Get direct experience working with APIs and Postman, an industry-standard tool.","04/10/2021 18:00 GMT-0400","APIs 101 with Postman","https://platform.bit.camp/6gBfQk","true","04/10/2021 17:00 GMT-0400","zoom03@bit.camp","https://zoom.us/j/8938906433?pwd=a2FEbXRmbWpIb2VCNnF3dWlMR2IvQT09"
"workshop-event","1","Saturday","Learn how to build basic logical gates and constructs in Minecraft, and apply those basics to build and optimize fun, useful creations using the in-game Redstone mechanic. Beginners welcome!","04/10/2021 19:00 GMT-0400","Digital Logic Through Minecraft","https://platform.bit.camp/ysvdPt","true","04/10/2021 18:00 GMT-0400","zoom03@bit.camp","https://zoom.us/j/8938906433?pwd=a2FEbXRmbWpIb2VCNnF3dWlMR2IvQT09"
"mini-event","4","Saturday","Team up with fellow hackers and test your trivia knowledge!","04/10/2021 13:00 GMT-0400","Trivia","https://zoom.us/j/7435458110?pwd=OGVDdnlHWkVBOHhqUTNxb0FLb3VmUT09","true","04/10/2021 12:00 GMT-0400","zoom01@bit.camp","https://zoom.us/j/7435458110?pwd=OGVDdnlHWkVBOHhqUTNxb0FLb3VmUT09"
"workshop-event","2","Saturday","This Tech Talk outlines how T. Rowe Price has embraced cloud technologies to solve complex problems, accelerate development and build great tech.","04/10/2021 11:00 GMT-0400","How Cloud Powers FinTech at T. Rowe Price","https://platform.bit.camp/KxCIet","true","04/10/2021 10:00 GMT-0400","zoom03@bit.camp","https://zoom.us/j/8938906433?pwd=a2FEbXRmbWpIb2VCNnF3dWlMR2IvQT09"